{
  "contractName": "CartesiComputeInterface",
  "sourceName": "cache/solpp-generated-contracts/CartesiComputeInterface.sol",
  "abi": [
    {
      "inputs": [
        {
          "internalType": "uint256",
          "name": "_index",
          "type": "uint256"
        }
      ],
      "name": "destruct",
      "outputs": [],
      "stateMutability": "nonpayable",
      "type": "function"
    },
    {
      "inputs": [
        {
          "internalType": "uint256",
          "name": "_index",
          "type": "uint256"
        }
      ],
      "name": "getNonce",
      "outputs": [
        {
          "internalType": "uint256",
          "name": "",
          "type": "uint256"
        }
      ],
      "stateMutability": "view",
      "type": "function"
    },
    {
      "inputs": [
        {
          "internalType": "uint256",
          "name": "_index",
          "type": "uint256"
        }
      ],
      "name": "getResult",
      "outputs": [
        {
          "internalType": "bool",
          "name": "",
          "type": "bool"
        },
        {
          "internalType": "bool",
          "name": "",
          "type": "bool"
        },
        {
          "internalType": "address",
          "name": "",
          "type": "address"
        },
        {
          "internalType": "bytes",
          "name": "",
          "type": "bytes"
        }
      ],
      "stateMutability": "view",
      "type": "function"
    },
    {
      "inputs": [
        {
          "internalType": "uint256",
          "name": "_index",
          "type": "uint256"
        },
        {
          "internalType": "address",
          "name": "",
          "type": "address"
        }
      ],
      "name": "getSubInstances",
      "outputs": [
        {
          "internalType": "address[]",
          "name": "_addresses",
          "type": "address[]"
        },
        {
          "internalType": "uint256[]",
          "name": "_indices",
          "type": "uint256[]"
        }
      ],
      "stateMutability": "view",
      "type": "function"
    },
    {
      "inputs": [
        {
          "internalType": "uint256",
          "name": "_finalTime",
          "type": "uint256"
        },
        {
          "internalType": "bytes32",
          "name": "_templateHash",
          "type": "bytes32"
        },
        {
          "internalType": "uint64",
          "name": "_outputPosition",
          "type": "uint64"
        },
        {
          "internalType": "uint8",
          "name": "_outputLog2Size",
          "type": "uint8"
        },
        {
          "internalType": "uint256",
          "name": "_roundDuration",
          "type": "uint256"
        },
        {
          "internalType": "address[]",
          "name": "parties",
          "type": "address[]"
        },
        {
          "components": [
            {
              "internalType": "uint64",
              "name": "position",
              "type": "uint64"
            },
            {
              "internalType": "uint8",
              "name": "driveLog2Size",
              "type": "uint8"
            },
            {
              "internalType": "bytes",
              "name": "directValue",
              "type": "bytes"
            },
            {
              "internalType": "bytes",
              "name": "loggerIpfsPath",
              "type": "bytes"
            },
            {
              "internalType": "bytes32",
              "name": "loggerRootHash",
              "type": "bytes32"
            },
            {
              "internalType": "address",
              "name": "provider",
              "type": "address"
            },
            {
              "internalType": "bool",
              "name": "waitsProvider",
              "type": "bool"
            },
            {
              "internalType": "bool",
              "name": "needsLogger",
              "type": "bool"
            }
          ],
          "internalType": "struct CartesiComputeInterface.Drive[]",
          "name": "_inputDrives",
          "type": "tuple[]"
        }
      ],
      "name": "instantiate",
      "outputs": [
        {
          "internalType": "uint256",
          "name": "",
          "type": "uint256"
        }
      ],
      "stateMutability": "nonpayable",
      "type": "function"
    },
    {
      "inputs": [
        {
          "internalType": "uint256",
          "name": "_index",
          "type": "uint256"
        }
      ],
      "name": "isActive",
      "outputs": [
        {
          "internalType": "bool",
          "name": "",
          "type": "bool"
        }
      ],
      "stateMutability": "view",
      "type": "function"
    },
    {
      "inputs": [
        {
          "internalType": "uint256",
          "name": "_index",
          "type": "uint256"
        },
        {
          "internalType": "address",
          "name": "_user",
          "type": "address"
        }
      ],
      "name": "isConcerned",
      "outputs": [
        {
          "internalType": "bool",
          "name": "",
          "type": "bool"
        }
      ],
      "stateMutability": "view",
      "type": "function"
    }
  ],
  "bytecode": "0x",
  "deployedBytecode": "0x",
  "linkReferences": {},
  "deployedLinkReferences": {},
  "devdoc": {
    "kind": "dev",
    "methods": {
      "destruct(uint256)": {
        "params": {
          "_index": "index of Cartesi Compute instance to deactivate"
        }
      },
      "getResult(uint256)": {
        "params": {
          "_index": "index of Cartesi Compute instance to get result"
        },
        "returns": {
          "_0": "bool, indicates the result is ready",
          "_1": "bool, indicates the sdk is still running",
          "_2": "address, the user to blame for the abnormal stop of the sdk",
          "_3": "bytes32, the result of the sdk if available"
        }
      },
      "instantiate(uint256,bytes32,uint64,uint8,uint256,address[],(uint64,uint8,bytes,bytes,bytes32,address,bool,bool)[])": {
        "params": {
          "_finalTime": "max cycle of the machine for that computation",
          "_inputDrives": "an array of drive which assemble the machine",
          "_outputPosition": "position of the output drive",
          "_roundDuration": "duration of the round (security param)",
          "_templateHash": "hash of the machine with all drives empty"
        },
        "returns": {
          "_0": "uint256, CartesiCompute index"
        }
      }
    },
    "version": 1
  },
  "evm": {
    "bytecode": {
      "generatedSources": [],
      "linkReferences": {},
      "object": "",
      "opcodes": "",
      "sourceMap": ""
    },
    "deployedBytecode": {
      "generatedSources": [],
      "immutableReferences": {},
      "linkReferences": {},
      "object": "",
      "opcodes": "",
      "sourceMap": ""
    },
    "gasEstimates": null,
    "methodIdentifiers": {
      "destruct(uint256)": "c87e3ae9",
      "getNonce(uint256)": "3d46b819",
      "getResult(uint256)": "995e4339",
      "getSubInstances(uint256,address)": "c526656c",
      "instantiate(uint256,bytes32,uint64,uint8,uint256,address[],(uint64,uint8,bytes,bytes,bytes32,address,bool,bool)[])": "c817592d",
      "isActive(uint256)": "82afd23b",
      "isConcerned(uint256,address)": "01ff62ab"
    }
  },
  "metadata": "{\"compiler\":{\"version\":\"0.7.4+commit.3f05b770\"},\"language\":\"Solidity\",\"output\":{\"abi\":[{\"inputs\":[{\"internalType\":\"uint256\",\"name\":\"_index\",\"type\":\"uint256\"}],\"name\":\"destruct\",\"outputs\":[],\"stateMutability\":\"nonpayable\",\"type\":\"function\"},{\"inputs\":[{\"internalType\":\"uint256\",\"name\":\"_index\",\"type\":\"uint256\"}],\"name\":\"getNonce\",\"outputs\":[{\"internalType\":\"uint256\",\"name\":\"\",\"type\":\"uint256\"}],\"stateMutability\":\"view\",\"type\":\"function\"},{\"inputs\":[{\"internalType\":\"uint256\",\"name\":\"_index\",\"type\":\"uint256\"}],\"name\":\"getResult\",\"outputs\":[{\"internalType\":\"bool\",\"name\":\"\",\"type\":\"bool\"},{\"internalType\":\"bool\",\"name\":\"\",\"type\":\"bool\"},{\"internalType\":\"address\",\"name\":\"\",\"type\":\"address\"},{\"internalType\":\"bytes\",\"name\":\"\",\"type\":\"bytes\"}],\"stateMutability\":\"view\",\"type\":\"function\"},{\"inputs\":[{\"internalType\":\"uint256\",\"name\":\"_index\",\"type\":\"uint256\"},{\"internalType\":\"address\",\"name\":\"\",\"type\":\"address\"}],\"name\":\"getSubInstances\",\"outputs\":[{\"internalType\":\"address[]\",\"name\":\"_addresses\",\"type\":\"address[]\"},{\"internalType\":\"uint256[]\",\"name\":\"_indices\",\"type\":\"uint256[]\"}],\"stateMutability\":\"view\",\"type\":\"function\"},{\"inputs\":[{\"internalType\":\"uint256\",\"name\":\"_finalTime\",\"type\":\"uint256\"},{\"internalType\":\"bytes32\",\"name\":\"_templateHash\",\"type\":\"bytes32\"},{\"internalType\":\"uint64\",\"name\":\"_outputPosition\",\"type\":\"uint64\"},{\"internalType\":\"uint8\",\"name\":\"_outputLog2Size\",\"type\":\"uint8\"},{\"internalType\":\"uint256\",\"name\":\"_roundDuration\",\"type\":\"uint256\"},{\"internalType\":\"address[]\",\"name\":\"parties\",\"type\":\"address[]\"},{\"components\":[{\"internalType\":\"uint64\",\"name\":\"position\",\"type\":\"uint64\"},{\"internalType\":\"uint8\",\"name\":\"driveLog2Size\",\"type\":\"uint8\"},{\"internalType\":\"bytes\",\"name\":\"directValue\",\"type\":\"bytes\"},{\"internalType\":\"bytes\",\"name\":\"loggerIpfsPath\",\"type\":\"bytes\"},{\"internalType\":\"bytes32\",\"name\":\"loggerRootHash\",\"type\":\"bytes32\"},{\"internalType\":\"address\",\"name\":\"provider\",\"type\":\"address\"},{\"internalType\":\"bool\",\"name\":\"waitsProvider\",\"type\":\"bool\"},{\"internalType\":\"bool\",\"name\":\"needsLogger\",\"type\":\"bool\"}],\"internalType\":\"struct CartesiComputeInterface.Drive[]\",\"name\":\"_inputDrives\",\"type\":\"tuple[]\"}],\"name\":\"instantiate\",\"outputs\":[{\"internalType\":\"uint256\",\"name\":\"\",\"type\":\"uint256\"}],\"stateMutability\":\"nonpayable\",\"type\":\"function\"},{\"inputs\":[{\"internalType\":\"uint256\",\"name\":\"_index\",\"type\":\"uint256\"}],\"name\":\"isActive\",\"outputs\":[{\"internalType\":\"bool\",\"name\":\"\",\"type\":\"bool\"}],\"stateMutability\":\"view\",\"type\":\"function\"},{\"inputs\":[{\"internalType\":\"uint256\",\"name\":\"_index\",\"type\":\"uint256\"},{\"internalType\":\"address\",\"name\":\"_user\",\"type\":\"address\"}],\"name\":\"isConcerned\",\"outputs\":[{\"internalType\":\"bool\",\"name\":\"\",\"type\":\"bool\"}],\"stateMutability\":\"view\",\"type\":\"function\"}],\"devdoc\":{\"kind\":\"dev\",\"methods\":{\"destruct(uint256)\":{\"params\":{\"_index\":\"index of Cartesi Compute instance to deactivate\"}},\"getResult(uint256)\":{\"params\":{\"_index\":\"index of Cartesi Compute instance to get result\"},\"returns\":{\"_0\":\"bool, indicates the result is ready\",\"_1\":\"bool, indicates the sdk is still running\",\"_2\":\"address, the user to blame for the abnormal stop of the sdk\",\"_3\":\"bytes32, the result of the sdk if available\"}},\"instantiate(uint256,bytes32,uint64,uint8,uint256,address[],(uint64,uint8,bytes,bytes,bytes32,address,bool,bool)[])\":{\"params\":{\"_finalTime\":\"max cycle of the machine for that computation\",\"_inputDrives\":\"an array of drive which assemble the machine\",\"_outputPosition\":\"position of the output drive\",\"_roundDuration\":\"duration of the round (security param)\",\"_templateHash\":\"hash of the machine with all drives empty\"},\"returns\":{\"_0\":\"uint256, CartesiCompute index\"}}},\"version\":1},\"userdoc\":{\"kind\":\"user\",\"methods\":{\"destruct(uint256)\":{\"notice\":\"Deactivate a Cartesi Compute SDK instance.\"},\"getResult(uint256)\":{\"notice\":\"Get result of a finished instance.\"},\"instantiate(uint256,bytes32,uint64,uint8,uint256,address[],(uint64,uint8,bytes,bytes,bytes32,address,bool,bool)[])\":{\"notice\":\"Instantiate a Cartesi Compute SDK instance.\"}},\"version\":1}},\"settings\":{\"compilationTarget\":{\"cache/solpp-generated-contracts/CartesiComputeInterface.sol\":\"CartesiComputeInterface\"},\"evmVersion\":\"istanbul\",\"libraries\":{},\"metadata\":{\"bytecodeHash\":\"ipfs\",\"useLiteralContent\":true},\"optimizer\":{\"enabled\":true,\"runs\":110},\"remappings\":[]},\"sources\":{\"@cartesi/util/contracts/Instantiator.sol\":{\"content\":\"// Copyright 2020 Cartesi Pte. Ltd.\\n\\n// SPDX-License-Identifier: Apache-2.0\\n// Licensed under the Apache License, Version 2.0 (the \\\"License\\\"); you may not use\\n// this file except in compliance with the License. You may obtain a copy of the\\n// License at http://www.apache.org/licenses/LICENSE-2.0\\n\\n// Unless required by applicable law or agreed to in writing, software distributed\\n// under the License is distributed on an \\\"AS IS\\\" BASIS, WITHOUT WARRANTIES OR\\n// CONDITIONS OF ANY KIND, either express or implied. See the License for the\\n// specific language governing permissions and limitations under the License.\\n\\n\\npragma solidity ^0.7.0;\\n\\n\\ninterface Instantiator {\\n\\n    modifier onlyInstantiated(uint256 _index) virtual;\\n\\n    modifier onlyActive(uint256 _index) virtual;\\n\\n    modifier increasesNonce(uint256 _index) virtual;\\n\\n    function isActive(uint256 _index) external view returns (bool);\\n\\n    function getNonce(uint256 _index) external view returns (uint256);\\n\\n    function isConcerned(uint256 _index, address _user) external view returns (bool);\\n\\n    function getSubInstances(uint256 _index, address) external view returns (address[] memory _addresses, uint256[] memory _indices);\\n}\\n\",\"keccak256\":\"0x416e612dc09b10765de32ec06cf0a7ee4e050e16db8bf3b8ad832a6082b7dfd6\",\"license\":\"Apache-2.0\"},\"cache/solpp-generated-contracts/CartesiComputeInterface.sol\":{\"content\":\"pragma solidity ^0.7.0;\\npragma experimental ABIEncoderV2;\\n\\n// SPDX-License-Identifier: Apache-2.0\\n//                                  Apache License\\n//                            Version 2.0, January 2004\\n//                         http://www.apache.org/licenses/\\n\\n//    TERMS AND CONDITIONS FOR USE, REPRODUCTION, AND DISTRIBUTION\\n\\n//    1. Definitions.\\n\\n//       \\\"License\\\" shall mean the terms and conditions for use, reproduction,\\n//       and distribution as defined by Sections 1 through 9 of this document.\\n\\n//       \\\"Licensor\\\" shall mean the copyright owner or entity authorized by\\n//       the copyright owner that is granting the License.\\n\\n//       \\\"Legal Entity\\\" shall mean the union of the acting entity and all\\n//       other entities that control, are controlled by, or are under common\\n//       control with that entity. For the purposes of this definition,\\n//       \\\"control\\\" means (i) the power, direct or indirect, to cause the\\n//       direction or management of such entity, whether by contract or\\n//       otherwise, or (ii) ownership of fifty percent (50%) or more of the\\n//       outstanding shares, or (iii) beneficial ownership of such entity.\\n\\n//       \\\"You\\\" (or \\\"Your\\\") shall mean an individual or Legal Entity\\n//       exercising permissions granted by this License.\\n\\n//       \\\"Source\\\" form shall mean the preferred form for making modifications,\\n//       including but not limited to software source code, documentation\\n//       source, and configuration files.\\n\\n//       \\\"Object\\\" form shall mean any form resulting from mechanical\\n//       transformation or translation of a Source form, including but\\n//       not limited to compiled object code, generated documentation,\\n//       and conversions to other media types.\\n\\n//       \\\"Work\\\" shall mean the work of authorship, whether in Source or\\n//       Object form, made available under the License, as indicated by a\\n//       copyright notice that is included in or attached to the work\\n//       (an example is provided in the Appendix below).\\n\\n//       \\\"Derivative Works\\\" shall mean any work, whether in Source or Object\\n//       form, that is based on (or derived from) the Work and for which the\\n//       editorial revisions, annotations, elaborations, or other modifications\\n//       represent, as a whole, an original work of authorship. For the purposes\\n//       of this License, Derivative Works shall not include works that remain\\n//       separable from, or merely link (or bind by name) to the interfaces of,\\n//       the Work and Derivative Works thereof.\\n\\n//       \\\"Contribution\\\" shall mean any work of authorship, including\\n//       the original version of the Work and any modifications or additions\\n//       to that Work or Derivative Works thereof, that is intentionally\\n//       submitted to Licensor for inclusion in the Work by the copyright owner\\n//       or by an individual or Legal Entity authorized to submit on behalf of\\n//       the copyright owner. For the purposes of this definition, \\\"submitted\\\"\\n//       means any form of electronic, verbal, or written communication sent\\n//       to the Licensor or its representatives, including but not limited to\\n//       communication on electronic mailing lists, source code control systems,\\n//       and issue tracking systems that are managed by, or on behalf of, the\\n//       Licensor for the purpose of discussing and improving the Work, but\\n//       excluding communication that is conspicuously marked or otherwise\\n//       designated in writing by the copyright owner as \\\"Not a Contribution.\\\"\\n\\n//       \\\"Contributor\\\" shall mean Licensor and any individual or Legal Entity\\n//       on behalf of whom a Contribution has been received by Licensor and\\n//       subsequently incorporated within the Work.\\n\\n//    2. Grant of Copyright License. Subject to the terms and conditions of\\n//       this License, each Contributor hereby grants to You a perpetual,\\n//       worldwide, non-exclusive, no-charge, royalty-free, irrevocable\\n//       copyright license to reproduce, prepare Derivative Works of,\\n//       publicly display, publicly perform, sublicense, and distribute the\\n//       Work and such Derivative Works in Source or Object form.\\n\\n//    3. Grant of Patent License. Subject to the terms and conditions of\\n//       this License, each Contributor hereby grants to You a perpetual,\\n//       worldwide, non-exclusive, no-charge, royalty-free, irrevocable\\n//       (except as stated in this section) patent license to make, have made,\\n//       use, offer to sell, sell, import, and otherwise transfer the Work,\\n//       where such license applies only to those patent claims licensable\\n//       by such Contributor that are necessarily infringed by their\\n//       Contribution(s) alone or by combination of their Contribution(s)\\n//       with the Work to which such Contribution(s) was submitted. If You\\n//       institute patent litigation against any entity (including a\\n//       cross-claim or counterclaim in a lawsuit) alleging that the Work\\n//       or a Contribution incorporated within the Work constitutes direct\\n//       or contributory patent infringement, then any patent licenses\\n//       granted to You under this License for that Work shall terminate\\n//       as of the date such litigation is filed.\\n\\n//    4. Redistribution. You may reproduce and distribute copies of the\\n//       Work or Derivative Works thereof in any medium, with or without\\n//       modifications, and in Source or Object form, provided that You\\n//       meet the following conditions:\\n\\n//       (a) You must give any other recipients of the Work or\\n//           Derivative Works a copy of this License; and\\n\\n//       (b) You must cause any modified files to carry prominent notices\\n//           stating that You changed the files; and\\n\\n//       (c) You must retain, in the Source form of any Derivative Works\\n//           that You distribute, all copyright, patent, trademark, and\\n//           attribution notices from the Source form of the Work,\\n//           excluding those notices that do not pertain to any part of\\n//           the Derivative Works; and\\n\\n//       (d) If the Work includes a \\\"NOTICE\\\" text file as part of its\\n//           distribution, then any Derivative Works that You distribute must\\n//           include a readable copy of the attribution notices contained\\n//           within such NOTICE file, excluding those notices that do not\\n//           pertain to any part of the Derivative Works, in at least one\\n//           of the following places: within a NOTICE text file distributed\\n//           as part of the Derivative Works; within the Source form or\\n//           documentation, if provided along with the Derivative Works; or,\\n//           within a display generated by the Derivative Works, if and\\n//           wherever such third-party notices normally appear. The contents\\n//           of the NOTICE file are for informational purposes only and\\n//           do not modify the License. You may add Your own attribution\\n//           notices within Derivative Works that You distribute, alongside\\n//           or as an addendum to the NOTICE text from the Work, provided\\n//           that such additional attribution notices cannot be construed\\n//           as modifying the License.\\n\\n//       You may add Your own copyright statement to Your modifications and\\n//       may provide additional or different license terms and conditions\\n//       for use, reproduction, or distribution of Your modifications, or\\n//       for any such Derivative Works as a whole, provided Your use,\\n//       reproduction, and distribution of the Work otherwise complies with\\n//       the conditions stated in this License.\\n\\n//    5. Submission of Contributions. Unless You explicitly state otherwise,\\n//       any Contribution intentionally submitted for inclusion in the Work\\n//       by You to the Licensor shall be under the terms and conditions of\\n//       this License, without any additional terms or conditions.\\n//       Notwithstanding the above, nothing herein shall supersede or modify\\n//       the terms of any separate license agreement you may have executed\\n//       with Licensor regarding such Contributions.\\n\\n//    6. Trademarks. This License does not grant permission to use the trade\\n//       names, trademarks, service marks, or product names of the Licensor,\\n//       except as required for reasonable and customary use in describing the\\n//       origin of the Work and reproducing the content of the NOTICE file.\\n\\n//    7. Disclaimer of Warranty. Unless required by applicable law or\\n//       agreed to in writing, Licensor provides the Work (and each\\n//       Contributor provides its Contributions) on an \\\"AS IS\\\" BASIS,\\n//       WITHOUT WARRANTIES OR CONDITIONS OF ANY KIND, either express or\\n//       implied, including, without limitation, any warranties or conditions\\n//       of TITLE, NON-INFRINGEMENT, MERCHANTABILITY, or FITNESS FOR A\\n//       PARTICULAR PURPOSE. You are solely responsible for determining the\\n//       appropriateness of using or redistributing the Work and assume any\\n//       risks associated with Your exercise of permissions under this License.\\n\\n//    8. Limitation of Liability. In no event and under no legal theory,\\n//       whether in tort (including negligence), contract, or otherwise,\\n//       unless required by applicable law (such as deliberate and grossly\\n//       negligent acts) or agreed to in writing, shall any Contributor be\\n//       liable to You for damages, including any direct, indirect, special,\\n//       incidental, or consequential damages of any character arising as a\\n//       result of this License or out of the use or inability to use the\\n//       Work (including but not limited to damages for loss of goodwill,\\n//       work stoppage, computer failure or malfunction, or any and all\\n//       other commercial damages or losses), even if such Contributor\\n//       has been advised of the possibility of such damages.\\n\\n//    9. Accepting Warranty or Additional Liability. While redistributing\\n//       the Work or Derivative Works thereof, You may choose to offer,\\n//       and charge a fee for, acceptance of support, warranty, indemnity,\\n//       or other liability obligations and/or rights consistent with this\\n//       License. However, in accepting such obligations, You may act only\\n//       on Your own behalf and on Your sole responsibility, not on behalf\\n//       of any other Contributor, and only if You agree to indemnify,\\n//       defend, and hold each Contributor harmless for any liability\\n//       incurred by, or claims asserted against, such Contributor by reason\\n//       of your accepting any such warranty or additional liability.\\n\\n//    END OF TERMS AND CONDITIONS\\n\\n//    Copyright (C) 2020 Cartesi Pte. Ltd.\\n\\n//    Licensed under the Apache License, Version 2.0 (the \\\"License\\\");\\n//    you may not use this file except in compliance with the License.\\n//    You may obtain a copy of the License at\\n\\n//        http://www.apache.org/licenses/LICENSE-2.0\\n\\n//    Unless required by applicable law or agreed to in writing, software\\n//    distributed under the License is distributed on an \\\"AS IS\\\" BASIS,\\n//    WITHOUT WARRANTIES OR CONDITIONS OF ANY KIND, either express or implied.\\n//    See the License for the specific language governing permissions and\\n//    limitations under the License.\\n\\n/// @title CartesiComputeInterface\\n/// @author Stephen Chen\\n\\n\\n\\nimport \\\"@cartesi/util/contracts/Instantiator.sol\\\";\\n\\n\\ninterface CartesiComputeInterface is Instantiator {\\n\\n    enum State {\\n        WaitingProviders,\\n        ProviderMissedDeadline,\\n        WaitingChallengeDrives,\\n        WaitingReveals,\\n        WaitingClaim,\\n        ClaimerMissedDeadline,\\n        WaitingConfirmationDeadline, // \\\"Voting Phase\\\"\\n        WaitingChallengeResult, // \\\"Voting Phase\\\"\\n        ChallengerWon,\\n        ClaimerWon,\\n        ConsensusResult\\n    }\\n\\n    /*\\n    There are two types of drive, one is directDrive, and the other is loggerDrive.\\n    directDrive has content inserted to the directValue field with up to 1MB;\\n    loggerDrive has content submitted to the logger contract,\\n    which can be retrieved with driveLog2Size and loggerRootHash.\\n    The needsLogger field is set to true for loggerDrive, false for directDrive.\\n\\n    The waitsProvider field is set to true meaning the drive is not ready,\\n    and needs to be filled during the WaitingProviders phase.\\n    The provider field is the user who is responsible for filling out the drive.\\n    I.e the directValue of directDrive, or the loggerRootHash of loggerDrive\\n    */\\n    struct Drive {\\n        // start position of the drive\\n        uint64 position;\\n        // log2 size of the drive in the unit of bytes\\n        uint8 driveLog2Size;\\n        // direct value inserted to the drive\\n        bytes directValue;\\n        // ipfs object path of the logger drive\\n        bytes loggerIpfsPath;\\n        // root hash of the drive submitted to the logger\\n        bytes32 loggerRootHash;\\n        // the user who's responsible for filling out the drive\\n        address provider;\\n        // indicates the drive needs to wait for the provider to provide content\\n        bool waitsProvider;\\n        // indicates the content of the drive must be retrieved from logger\\n        bool needsLogger;\\n    }\\n\\n    struct Party {\\n        bool isParty;\\n        bool hasVoted;\\n        bool hasCheated;\\n        uint64 arrayIdx;\\n    }\\n\\n    /// @notice Instantiate a Cartesi Compute SDK instance.\\n    /// @param _finalTime max cycle of the machine for that computation\\n    /// @param _templateHash hash of the machine with all drives empty\\n    /// @param _outputPosition position of the output drive\\n    /// @param _roundDuration duration of the round (security param)\\n    /// @param _inputDrives an array of drive which assemble the machine\\n    /// @return uint256, CartesiCompute index\\n    function instantiate(\\n        uint256 _finalTime,\\n        bytes32 _templateHash,\\n        uint64 _outputPosition,\\n        uint8 _outputLog2Size,\\n        uint256 _roundDuration,\\n        address[] memory parties,\\n        Drive[] memory _inputDrives) external returns (uint256);\\n\\n    /// @notice Get result of a finished instance.\\n    /// @param _index index of Cartesi Compute instance to get result\\n    /// @return bool, indicates the result is ready\\n    /// @return bool, indicates the sdk is still running\\n    /// @return address, the user to blame for the abnormal stop of the sdk\\n    /// @return bytes32, the result of the sdk if available\\n    function getResult(uint256 _index) external view returns (\\n        bool,\\n        bool,\\n        address,\\n        bytes memory);\\n\\n    /// @notice Deactivate a Cartesi Compute SDK instance.\\n    /// @param _index index of Cartesi Compute instance to deactivate\\n    function destruct(uint256 _index) external;\\n}\\n\",\"keccak256\":\"0x29890d2e11beedcb846bfe042503999a0c5f6e04633ef73d06b63d3cbccd553e\",\"license\":\"Apache-2.0\"}},\"version\":1}",
  "storageLayout": {
    "storage": [],
    "types": null
  },
  "userdoc": {
    "kind": "user",
    "methods": {
      "destruct(uint256)": {
        "notice": "Deactivate a Cartesi Compute SDK instance."
      },
      "getResult(uint256)": {
        "notice": "Get result of a finished instance."
      },
      "instantiate(uint256,bytes32,uint64,uint8,uint256,address[],(uint64,uint8,bytes,bytes,bytes32,address,bool,bool)[])": {
        "notice": "Instantiate a Cartesi Compute SDK instance."
      }
    },
    "version": 1
  }
}