{
  "contractName": "Instantiator",
  "sourceName": "@cartesi/util/contracts/Instantiator.sol",
  "abi": [
    {
      "inputs": [
        {
          "internalType": "uint256",
          "name": "_index",
          "type": "uint256"
        }
      ],
      "name": "getNonce",
      "outputs": [
        {
          "internalType": "uint256",
          "name": "",
          "type": "uint256"
        }
      ],
      "stateMutability": "view",
      "type": "function"
    },
    {
      "inputs": [
        {
          "internalType": "uint256",
          "name": "_index",
          "type": "uint256"
        },
        {
          "internalType": "address",
          "name": "",
          "type": "address"
        }
      ],
      "name": "getSubInstances",
      "outputs": [
        {
          "internalType": "address[]",
          "name": "_addresses",
          "type": "address[]"
        },
        {
          "internalType": "uint256[]",
          "name": "_indices",
          "type": "uint256[]"
        }
      ],
      "stateMutability": "view",
      "type": "function"
    },
    {
      "inputs": [
        {
          "internalType": "uint256",
          "name": "_index",
          "type": "uint256"
        }
      ],
      "name": "isActive",
      "outputs": [
        {
          "internalType": "bool",
          "name": "",
          "type": "bool"
        }
      ],
      "stateMutability": "view",
      "type": "function"
    },
    {
      "inputs": [
        {
          "internalType": "uint256",
          "name": "_index",
          "type": "uint256"
        },
        {
          "internalType": "address",
          "name": "_user",
          "type": "address"
        }
      ],
      "name": "isConcerned",
      "outputs": [
        {
          "internalType": "bool",
          "name": "",
          "type": "bool"
        }
      ],
      "stateMutability": "view",
      "type": "function"
    }
  ],
  "bytecode": "0x",
  "deployedBytecode": "0x",
  "linkReferences": {},
  "deployedLinkReferences": {},
  "devdoc": {
    "kind": "dev",
    "methods": {},
    "version": 1
  },
  "evm": {
    "bytecode": {
      "generatedSources": [],
      "linkReferences": {},
      "object": "",
      "opcodes": "",
      "sourceMap": ""
    },
    "deployedBytecode": {
      "generatedSources": [],
      "immutableReferences": {},
      "linkReferences": {},
      "object": "",
      "opcodes": "",
      "sourceMap": ""
    },
    "gasEstimates": null,
    "methodIdentifiers": {
      "getNonce(uint256)": "3d46b819",
      "getSubInstances(uint256,address)": "c526656c",
      "isActive(uint256)": "82afd23b",
      "isConcerned(uint256,address)": "01ff62ab"
    }
  },
  "metadata": "{\"compiler\":{\"version\":\"0.7.4+commit.3f05b770\"},\"language\":\"Solidity\",\"output\":{\"abi\":[{\"inputs\":[{\"internalType\":\"uint256\",\"name\":\"_index\",\"type\":\"uint256\"}],\"name\":\"getNonce\",\"outputs\":[{\"internalType\":\"uint256\",\"name\":\"\",\"type\":\"uint256\"}],\"stateMutability\":\"view\",\"type\":\"function\"},{\"inputs\":[{\"internalType\":\"uint256\",\"name\":\"_index\",\"type\":\"uint256\"},{\"internalType\":\"address\",\"name\":\"\",\"type\":\"address\"}],\"name\":\"getSubInstances\",\"outputs\":[{\"internalType\":\"address[]\",\"name\":\"_addresses\",\"type\":\"address[]\"},{\"internalType\":\"uint256[]\",\"name\":\"_indices\",\"type\":\"uint256[]\"}],\"stateMutability\":\"view\",\"type\":\"function\"},{\"inputs\":[{\"internalType\":\"uint256\",\"name\":\"_index\",\"type\":\"uint256\"}],\"name\":\"isActive\",\"outputs\":[{\"internalType\":\"bool\",\"name\":\"\",\"type\":\"bool\"}],\"stateMutability\":\"view\",\"type\":\"function\"},{\"inputs\":[{\"internalType\":\"uint256\",\"name\":\"_index\",\"type\":\"uint256\"},{\"internalType\":\"address\",\"name\":\"_user\",\"type\":\"address\"}],\"name\":\"isConcerned\",\"outputs\":[{\"internalType\":\"bool\",\"name\":\"\",\"type\":\"bool\"}],\"stateMutability\":\"view\",\"type\":\"function\"}],\"devdoc\":{\"kind\":\"dev\",\"methods\":{},\"version\":1},\"userdoc\":{\"kind\":\"user\",\"methods\":{},\"version\":1}},\"settings\":{\"compilationTarget\":{\"@cartesi/util/contracts/Instantiator.sol\":\"Instantiator\"},\"evmVersion\":\"istanbul\",\"libraries\":{},\"metadata\":{\"bytecodeHash\":\"ipfs\",\"useLiteralContent\":true},\"optimizer\":{\"enabled\":true,\"runs\":110},\"remappings\":[]},\"sources\":{\"@cartesi/util/contracts/Instantiator.sol\":{\"content\":\"// Copyright 2020 Cartesi Pte. Ltd.\\n\\n// SPDX-License-Identifier: Apache-2.0\\n// Licensed under the Apache License, Version 2.0 (the \\\"License\\\"); you may not use\\n// this file except in compliance with the License. You may obtain a copy of the\\n// License at http://www.apache.org/licenses/LICENSE-2.0\\n\\n// Unless required by applicable law or agreed to in writing, software distributed\\n// under the License is distributed on an \\\"AS IS\\\" BASIS, WITHOUT WARRANTIES OR\\n// CONDITIONS OF ANY KIND, either express or implied. See the License for the\\n// specific language governing permissions and limitations under the License.\\n\\n\\npragma solidity ^0.7.0;\\n\\n\\ninterface Instantiator {\\n\\n    modifier onlyInstantiated(uint256 _index) virtual;\\n\\n    modifier onlyActive(uint256 _index) virtual;\\n\\n    modifier increasesNonce(uint256 _index) virtual;\\n\\n    function isActive(uint256 _index) external view returns (bool);\\n\\n    function getNonce(uint256 _index) external view returns (uint256);\\n\\n    function isConcerned(uint256 _index, address _user) external view returns (bool);\\n\\n    function getSubInstances(uint256 _index, address) external view returns (address[] memory _addresses, uint256[] memory _indices);\\n}\\n\",\"keccak256\":\"0x416e612dc09b10765de32ec06cf0a7ee4e050e16db8bf3b8ad832a6082b7dfd6\",\"license\":\"Apache-2.0\"}},\"version\":1}",
  "storageLayout": {
    "storage": [],
    "types": null
  },
  "userdoc": {
    "kind": "user",
    "methods": {},
    "version": 1
  }
}